{
  "schema_version": 1,
  "mode": "task",
  "budget": {
    "max_concurrency": 2,
    "max_write_lanes": 2,
    "cost_profile": "balanced"
  },
  "contracts": [],
  "lanes": [
    {
      "id": "cli-help-worker",
      "agent_type": "worker",
      "model_profile": "deep",
      "reasoning_profile": "medium",
      "depends_on": [],
      "read_scope": ["src/cli/help.ts"],
      "write_scope": ["src/cli/help.ts"],
      "acceptance": ["npm run test:cli"],
      "deliverable": "Updated CLI help text",
      "state": "ready",
      "held_reason": null,
      "launch_score": 7.5,
      "score_reasons": ["Disjoint write scope", "Lane-local checks pass"]
    },
    {
      "id": "docs-usage-worker",
      "agent_type": "worker",
      "model_profile": "balanced",
      "reasoning_profile": "low",
      "depends_on": [],
      "read_scope": ["docs/usage.md"],
      "write_scope": ["docs/usage.md"],
      "acceptance": ["npm run test:docs"],
      "deliverable": "Updated usage documentation",
      "state": "ready",
      "held_reason": null,
      "launch_score": 6.0,
      "score_reasons": ["Disjoint write scope", "Low risk doc update"]
    }
  ],
  "frontier": ["cli-help-worker", "docs-usage-worker"]
}
